<?xml version="1.0" encoding="UTF-8" standalone="yes"?>
<rezept xmlns="http://example.org/Rezepte" xmlns:xsi="http://www.w3.org/2001/XMLSchema-instance" xsi:schemaLocation="http://example.org/Rezepte Rezepte.xsd">
    <titel>p:titel</titel>
    <fotos>http://tempuri.org</fotos>
    <zutaten>
        <zutat>
            <bezeichnung>p:bezeichnung</bezeichnung>
            <menge>0.0</menge>
            <einheit>g</einheit>
        </zutat>
    </zutaten>
    <portionen>0</portionen>
    <zubereitung>
        <arbeitszeit>0</arbeitszeit>
        <schwierigkeitsgrad>simpel</schwierigkeitsgrad>
        <brennwertAnzeige>
            <menge2>1</menge2>
            <brennwert>kcal</brennwert>
        </brennwertAnzeige>
        <text>p:text</text>
    </zubereitung>
    <kommentare>
        <eintrag>
            <autor>han</autor>
            <datum>2013-04-13T16:01:00.071+02:00</datum>
            <text>sjskjsla</text>
        </eintrag>
        <eintrag>
            <autor>djhvkjsdhkjdhgv</autor>
            <datum>2013-04-13T16:01:46.216+02:00</datum>
            <text>jkhfsdkjxfhsdkjxhkjxhdgkjdxh</text>
        </eintrag>
    </kommentare>
</rezept>
