<?xml version="1.0" encoding="UTF-8" standalone="yes"?>
<rezept xmlns="http://example.org/Rezepte" xmlns:xsi="http://www.w3.org/2001/XMLSchema-instance" xsi:schemaLocation="http://example.org/Rezepte Rezepte.xsd">
    <titel>Lenchen's Schokoladenkuchen</titel>
    <fotos></fotos>
    <zutaten>
        <zutat id="1">
            <bezeichnung>Butter</bezeichnung>
            <menge>200.0</menge>
            <einheit>g</einheit>
        </zutat>
        <zutat id="2">
            <bezeichnung>Zucker</bezeichnung>
            <menge>200.0</menge>
            <einheit>g</einheit>
        </zutat>
        <zutat id="3">
            <bezeichnung>Schokolade, Blockschokolade</bezeichnung>
            <menge>200.0</menge>
            <einheit>g</einheit>
        </zutat>
        <zutat id="4">
            <bezeichnung>Mehl</bezeichnung>
            <menge>120.0</menge>
            <einheit>g</einheit>
        </zutat>
        <zutat id="5">
            <bezeichnung>Backpulver</bezeichnung>
            <menge>0.5</menge>
            <einheit>TL</einheit>
        </zutat>
        <zutat id="6">
            <bezeichnung>Vanillezucker</bezeichnung>
            <menge>1.0</menge>
            <einheit>Pkt.</einheit>
        </zutat>
        <zutat id="7">
            <bezeichnung>Eier</bezeichnung>
            <menge>4.0</menge>
            <einheit>Ei</einheit>
        </zutat>
    </zutaten>
    <portionen>16</portionen>
    <zubereitung>
        <arbeitszeit>60</arbeitszeit>
        <schwierigkeitsgrad>simpel</schwierigkeitsgrad>
        <brennwertAnzeige>
            <menge2>295</menge2>
            <brennwert>kcal</brennwert>
        </brennwertAnzeige>
        <text>Butter und Schokolade im Wasserbad schmelzen. Eier trennen. Eiweiß steif schlagen. Eigelbe, Zucker und Vanillezucker verrühren. Geschmolzene Butter-Schokomasse hinzufügen und mischen. Mehl mit dem Backpulver in die Masse sieben und zum Schluss die steifen Eiweiße vorsichtig unterheben. In eine gut gefettete Form geben. 
Bei 180°Grad 40 – 50 Minuten backen.</text>
    </zubereitung>
    <kommentare>
        <eintrag>
            <autor>swieselchen</autor>
            <datum>2002-02-07T18:49:00</datum>
            <text>Habe Deinen Kuchen gestern gebacken (kleine Abwandlung: statt Blockschokolade hatte ich nur Kuvertüre, zartbitter und ich habe noch etwas Rumaroma und eine Prise Salz dazugegeben) mein LAG war total begeistert. Ich übrigends auch, super Rezept. 
		</text>
        </eintrag>
        <eintrag>
            <autor>thecook</autor>
            <datum>2006-12-07T12:24:00</datum>
            <text>Habe ihn eben gebacken und bin begeistert.Super Rezept:-) 
		</text>
        </eintrag>
        <eintrag>
            <autor>2</autor>
            <datum>2013-04-13T16:14:03.402+02:00</datum>
            <text>hdskjh</text>
        </eintrag>
    </kommentare>
</rezept>
